[
    {
        "vcf": "/path/to/annotations/dbsnp/dbsnp_156.vcf.gz",
        "tbi": "/path/to/annotations/dbsnp/dbsnp_156.vcf.gz.tbi",
        "fields": "RS,COMMON,SAO",
        "prefix": "dbSNP_"
    },
    {
        "vcf": "/path/to/annotations/gnomad/gnomad.genomes.v4.0.sites.vcf.gz",
        "tbi": "/path/to/annotations/gnomad/gnomad.genomes.v4.0.sites.vcf.gz.tbi",
        "fields": "AF,AC,AN,nhomalt",
        "prefix": "gnomAD_"
    },
    {
        "vcf": "/path/to/annotations/clinvar/clinvar_20240101.vcf.gz",
        "tbi": "/path/to/annotations/clinvar/clinvar_20240101.vcf.gz.tbi",
        "fields": "CLNSIG,CLNDN,CLNREVSTAT",
        "prefix": "ClinVar_"
    },
    {
        "vcf": "/path/to/annotations/1000genomes/ALL.wgs.phase3_shapeit2_mvncall_integrated_v5c.20130502.sites.vcf.gz",
        "tbi": "/path/to/annotations/1000genomes/ALL.wgs.phase3_shapeit2_mvncall_integrated_v5c.20130502.sites.vcf.gz.tbi",
        "fields": "AF,AC,AN,EAS_AF,EUR_AF,AFR_AF,AMR_AF,SAS_AF",
        "prefix": "1000G_"
    },
    {
        "vcf": "/path/to/annotations/cosmic/cosmic_v99.vcf.gz",
        "tbi": "/path/to/annotations/cosmic/cosmic_v99.vcf.gz.tbi",
        "fields": "GENE,STRAND,CDS,AA,CNT",
        "prefix": "COSMIC_"
    },
    {
        "vcf": "/path/to/annotations/exac/ExAC.r1.sites.vep.vcf.gz",
        "tbi": "/path/to/annotations/exac/ExAC.r1.sites.vep.vcf.gz.tbi",
        "fields": "AF,AC,AN,AC_Adj,AN_Adj",
        "prefix": "ExAC_"
    },
    {
        "vcf": "/path/to/annotations/custom/my_custom_annotations.vcf.gz",
        "tbi": "/path/to/annotations/custom/my_custom_annotations.vcf.gz.tbi",
        "fields": "",
        "prefix": "Custom_"
    }
]
